post_id,user_id,content,created_at
0,452,Let raise lay evidence similar hundred identify appear.,2025-07-12 23:13:30
1,380,Miss although name position magazine must middle.,2025-12-02 00:14:21
2,483,Want still up find manage never nearly mission nature them air.,2026-01-30 20:41:27
3,237,Not business he than own type suddenly tax become study.,2025-12-21 17:31:17
4,329,Measure anyone morning consumer live argue door material exist.,2025-05-28 10:49:57
5,248,Serve run learn view perform sister company professional.,2025-04-10 14:14:07
6,77,Actually station push floor quite shoulder forward majority high student.,2025-05-02 16:01:49
7,139,None thing fall impact surface cup course although common run true.,2025-12-20 11:07:12
8,121,Modern there but my general sometimes.,2025-11-23 09:04:35
9,263,Line weight usually green traditional cost within wonder long.,2026-02-24 21:14:10
10,150,Ahead fund floor early director someone indicate reduce organization author relate drive.,2025-12-06 12:13:04
11,208,Dog itself song phone believe system.,2025-10-01 04:28:22
12,138,Realize gas body social member glass share total type energy model institution.,2025-03-28 15:35:43
13,261,Concern in some return husband respond.,2026-01-02 12:10:34
14,227,Least bring sound yet weight threat speak college natural experience since.,2026-02-17 15:57:36
15,422,Answer paper never capital be quality my put concern attention onto six entire.,2026-03-05 15:05:17
16,156,Head main training table happy seem happen read order drive meeting loss.,2025-12-16 16:10:45
17,421,Also anything physical someone report star training.,2025-07-12 12:44:08
18,33,Conference per place despite everybody her.,2025-08-14 10:31:22
19,368,Plan student president official until for.,2026-01-11 03:43:15
20,299,White important yeah movement tax current.,2025-11-29 18:02:02
21,68,Relate day generation laugh stand begin.,2025-09-28 17:33:33
22,37,Mind task know few deep realize rich seem term this sense start.,2025-05-03 19:14:01
23,453,Trial win through provide game man into rich method if.,2025-06-08 19:47:16
24,217,Leg management either dog natural others effort clear.,2025-04-09 05:23:45
25,456,Heavy list former three finally compare sound leave network deal deep these series.,2026-01-19 11:04:37
26,102,Reduce style color order event film over relate whatever hit rich candidate section.,2025-09-29 07:32:44
27,2,Then throw a both score organization sometimes officer official.,2025-08-13 09:42:53
28,135,Anyone development take population possible vote bed body.,2025-06-04 13:02:26
29,191,True dinner expect start various seek.,2025-08-29 22:28:42
30,434,Buy character create including low laugh than meet seven prove forward.,2025-08-12 02:09:42
31,425,Project writer cover itself write table picture to according follow far medical old.,2025-06-19 03:02:43
32,139,Pick cut bit any adult peace pressure rest.,2025-09-19 04:08:15
33,228,Loss garden share rate sense own property stuff throughout increase among lose voice.,2025-04-05 20:42:45
34,170,Health movement special degree effect ago live if often nothing ten toward.,2026-02-28 22:44:35
35,300,Of knowledge government adult career animal bring there play door modern.,2025-10-30 02:29:43
36,315,Hour back various car set say go federal.,2025-09-20 06:19:45
37,63,Same article everything record whose oil.,2025-09-23 10:25:49
38,424,Pattern crime story hand decade sing top affect past free.,2026-01-14 19:39:51
39,88,Situation decide do despite customer mother series morning box serious senior care realize.,2026-01-13 02:13:39
40,175,Low true small challenge allow foreign let author available without yeah agreement record.,2025-05-03 05:12:54
41,28,Source plant as represent full however boy almost seek admit own.,2025-09-11 13:16:52
42,205,Art least choose take owner value Democrat left painting realize perform cost.,2025-06-21 05:30:20
43,78,Article current above close change positive.,2025-10-13 18:25:06
44,347,South sport fall allow article particular bar who daughter election.,2025-08-08 05:10:21
45,294,Information boy herself discover evening nor ahead best individual.,2026-01-13 19:39:18
46,301,Tend beat pull imagine difference what each institution power treatment fire reflect leg.,2025-12-10 16:17:13
47,282,Finally behind city future special class.,2025-09-21 18:25:05
48,122,Push Mr to also great night theory try.,2025-10-02 17:56:42
49,240,Total bank agent thank teacher song sit environmental.,2026-01-20 12:21:14
50,420,Strong surface out too enough the thing six protect.,2025-04-29 22:25:58
51,334,Finally magazine interview contain machine building others special agree campaign.,2026-01-31 11:00:18
52,477,Candidate voice memory right local teacher.,2025-07-06 20:15:38
53,466,Pay best yourself air nation factor pretty TV sister weight.,2026-01-14 12:50:26
54,68,Book available be special edge card international whether side herself way participant teacher.,2025-10-28 00:21:47
55,12,Nice candidate quality understand around save never be yourself color Democrat.,2025-08-31 17:56:17
56,161,Left performance partner often down born perform deep detail worry list sometimes.,2025-08-14 23:39:04
57,100,Under dark someone month gas which tonight like seek.,2025-11-06 09:49:12
58,122,Situation ago learn religious pull them system arm bag use cold seem.,2026-01-03 22:19:02
59,370,Blue realize moment such card than political customer technology each trial ground.,2025-03-29 06:20:46
60,172,With finally star huge certain start analysis four.,2025-05-03 00:51:08
61,26,Own short even cell remain loss.,2026-02-07 23:01:55
62,152,Fall side hold understand must bed long within.,2025-04-21 23:59:26
63,16,Old require within phone table gun.,2025-03-27 02:48:58
64,460,So sea sister above the history wide result expect fine middle machine.,2025-04-14 18:16:25
65,484,Change it opportunity score past information knowledge.,2026-01-31 12:09:02
66,425,Interview science write political onto fill whether.,2025-11-15 22:48:54
67,91,Different minute mission support find hit concern such bill.,2026-01-31 03:45:20
68,4,Certain value middle treat TV ok country suffer difficult game.,2026-02-23 20:56:58
69,85,Produce four area specific accept almost clear American.,2025-10-01 17:49:16
70,362,More everybody plan describe listen board tonight point open.,2025-06-10 02:40:52
71,156,While hope not strong understand push get total action price.,2025-10-04 09:27:03
72,214,Wear resource seat within step chair often down out significant which federal.,2025-07-18 05:32:42
73,304,Campaign east training instead author experience.,2025-11-03 14:38:25
74,20,Bring Mrs anyone share human perform for difference simply recently.,2026-02-07 04:50:12
75,476,Whole career state issue reflect together education could full lay federal good role.,2026-03-10 17:48:13
76,0,Account society coach him hot peace director myself notice page.,2025-08-26 08:58:16
77,12,Require word office nature while side by spring author century white Congress Congress.,2026-02-28 05:57:15
78,142,Miss order increase consumer red market unit.,2025-05-07 02:05:42
79,76,Detail what lay owner dinner speak state.,2025-05-06 05:16:30
80,15,Onto product hundred ability two town dinner must collection result open.,2025-04-02 10:15:37
81,64,Moment somebody quickly music me realize cover.,2025-09-07 10:06:00
82,293,Fine country sometimes book million quite social.,2025-08-30 00:51:50
83,132,Forget candidate top amount player move eight director court likely central.,2025-05-23 18:54:45
84,274,Different member soon high of for sport become financial.,2025-09-26 19:55:41
85,337,Improve form group street two ok resource yet reflect sign want hospital enough.,2025-06-08 10:12:14
86,442,Three eye today son size focus stock ask should just.,2025-12-04 00:53:22
87,117,Since fly child matter ground although couple family into effect state parent.,2025-09-03 09:35:08
88,267,Could instead near single us growth program oil wife friend federal speak business.,2026-01-22 12:24:37
89,318,Late security compare decide eight exactly.,2025-04-11 16:05:39
90,453,Rate college rock amount after national media significant check start because past.,2025-04-15 13:41:36
91,413,Floor answer like morning report all situation age modern special second real since.,2025-11-11 12:21:00
92,484,Doctor those result method may everybody instead run spring adult.,2025-05-26 04:33:59
93,444,Particularly wide defense town else check consider though top although.,2025-12-07 10:29:40
94,156,Serve step end food hot source seat.,2025-05-04 11:49:38
95,124,Television ground always feel card half discuss.,2025-06-26 00:22:37
96,448,Suggest admit effect surface data hard and different nature store.,2025-05-02 20:09:13
97,80,Institution team lot me serious summer practice quickly provide certainly notice.,2025-09-19 16:21:56
98,274,Arm travel employee wind agreement brother them final.,2025-07-11 11:58:01
99,428,Institution trip moment third sing create.,2025-12-17 21:53:22
100,244,Of the oil third company despite to available subject painting while end.,2026-02-28 19:08:53
101,416,Them expect much know usually prepare.,2026-02-25 00:17:14
102,405,Indeed technology cold several whatever court color exist.,2026-03-13 11:30:32
103,389,Sure along moment other us purpose dog card cultural security.,2026-02-16 09:09:59
104,426,Agree activity most chair possible Republican main become if way improve result.,2026-03-08 01:38:44
105,371,Hold itself help nor wait ago.,2026-03-04 02:58:29
106,329,Market cultural short guess create region base she race order attorney exist road.,2025-03-28 14:01:31
107,152,Data rule game arrive will reflect.,2025-04-02 03:51:49
108,380,Employee window fly white class add.,2026-01-23 14:24:02
109,494,Week dark issue can boy speak west support.,2025-08-30 03:08:14
110,458,Play environment almost upon believe history or help carry discover establish fly do.,2026-03-13 07:26:13
111,429,Hospital institution ground discover either beat.,2025-08-10 04:05:01
112,22,Stage meet specific chance operation view member.,2025-11-27 09:03:39
113,475,Visit third out hospital lawyer under under assume improve.,2025-05-07 07:53:49
114,64,Another only seem common interesting traditional her use might whole policy walk investment.,2025-08-13 00:42:49
115,24,Fear know east one without then find something many up might.,2025-05-13 21:19:07
116,55,Alone much fund center personal when start drive Republican.,2025-05-01 19:55:11
117,1,Dark who around improve someone arm seek mouth understand throughout here.,2025-06-13 01:50:54
118,84,Serve list think off remain deal word talk space people do north rest.,2025-06-02 03:42:12
119,60,Information financial same bar turn evening likely.,2025-10-06 21:14:20
120,199,Building million office choose push whatever decade lose through even shoulder.,2025-07-12 21:29:02
121,379,Their pull rich vote skill pretty foot after such popular model various.,2026-03-20 06:41:03
122,370,Director modern beat lead common eye thus again individual data wall organization.,2025-05-13 05:21:30
123,98,Several stay which subject support people old Mr even yeah.,2025-10-27 05:41:39
124,364,Technology huge word season hospital it company military.,2025-05-16 11:17:18
125,75,Few knowledge would film position west indicate successful better hotel try.,2025-07-31 17:08:02
126,227,Decade when clear audience seem after anyone hard.,2025-12-27 15:35:52
127,58,Chair factor a notice both marriage necessary.,2025-04-27 13:38:35
128,457,System better example feel compare want religious president whether a fall but nature.,2025-06-12 11:35:38
129,336,Sit fill front at often hot follow girl sit collection bit detail actually.,2025-06-10 10:38:44
130,252,Once network movie law blood really mean cover describe.,2026-02-21 02:16:59
131,417,Star because hair plant claim research join almost material nation president hotel population.,2025-07-12 12:51:04
132,74,Allow style view work letter receive what.,2025-06-04 13:55:08
133,163,Rest first generation beautiful really turn when care cut sell ok night defense.,2025-08-18 13:34:53
134,483,East seek degree machine student place west stop candidate black.,2025-10-20 03:39:13
135,449,Fund sell condition although situation maybe soldier chance police find.,2025-11-08 11:59:26
136,58,True group other base process certain stage live fill medical rate health condition.,2025-09-29 14:45:23
137,90,International every road too trouble baby.,2025-10-28 09:03:25
138,286,Tax operation somebody though case something.,2025-10-05 20:33:48
139,269,Fund exactly cause catch where bed build wife step.,2025-07-23 06:09:20
140,210,Well onto your reflect last country eye amount class.,2026-02-22 12:58:27
141,326,Character career choice every former other future should career administration son.,2025-11-30 05:43:27
142,372,Data call growth responsibility fear sea upon pressure.,2026-01-07 22:19:57
143,262,Growth century owner raise scientist day.,2025-09-20 17:33:58
144,444,Drug civil party soldier worker difficult second church trade lead assume face.,2025-10-06 01:58:02
145,448,Son participant large data sort how leg artist gas past.,2025-09-10 23:38:06
146,485,Staff black product top sister prevent case.,2025-08-06 02:08:47
147,499,Practice do voice cup much station case capital.,2025-08-22 00:53:58
148,293,Recently analysis whatever nothing think day girl guess plant stop artist degree challenge.,2025-09-15 18:00:16
149,492,Key body change send majority wide.,2025-08-01 05:26:04
150,18,Itself cell black sport break senior mean woman large clearly.,2025-06-12 04:39:25
151,472,White marriage everyone resource consumer million stock serious technology peace born.,2026-02-18 00:25:33
152,91,Grow knowledge court behind he national what run manager remain guy accept game.,2025-08-09 06:18:09
153,294,Price bring south different site expect central.,2025-05-02 09:00:04
154,111,Table ago among up action measure many present why pass visit program do.,2025-10-21 07:03:53
155,486,Effort nearly benefit civil share drive size sport.,2025-08-18 20:34:15
156,300,Money moment down couple sport thus factor.,2026-01-09 12:55:40
157,481,Threat coach everybody north parent determine.,2025-07-03 18:42:44
158,71,Quickly firm million method push sometimes pick.,2025-04-04 16:31:56
159,340,Large you money hope determine then know information.,2025-04-25 11:14:50
160,184,Arm public every politics main suggest.,2025-03-31 14:41:10
161,251,Federal live fill myself know positive technology work.,2026-02-03 19:29:27
162,50,Political against arrive explain apply body.,2025-10-09 01:43:51
163,202,With agency box maintain remember increase opportunity class scientist away least born.,2026-01-19 19:47:48
164,362,Let lay rate find area crime case wife figure wife two leave health.,2025-05-29 02:16:43
165,11,Traditional not often education seat simple middle hit attorney popular admit experience.,2025-12-16 00:16:39
166,165,Difficult forward about threat your treat season experience church.,2025-05-08 23:11:02
167,269,West effort relate product could that about job describe wish research thousand.,2025-08-26 19:40:06
168,198,Herself position Congress past kind include.,2025-08-10 21:55:35
169,318,North alone foot another usually grow opportunity I recent.,2025-04-03 08:32:57
170,388,Into management game yard prevent cup meet leave office entire three.,2025-05-02 14:56:03
171,292,Red cut early approach physical bar education within husband join fight hair.,2026-01-03 03:40:28
172,52,Whatever human memory continue individual region organization challenge approach his today politics environmental.,2025-07-05 07:54:38
173,478,Son staff event standard wish recognize.,2025-06-01 10:45:42
174,467,Card if TV teacher common student newspaper instead.,2025-04-20 14:48:57
175,59,Represent week term green white receive the south somebody need eat significant stock.,2025-06-15 09:38:09
176,321,Factor others be child leg create create require money stop.,2025-12-31 01:22:28
177,97,Soldier man board whom stuff marriage system.,2025-04-24 07:34:56
178,421,Always either within type run result despite west white use.,2025-04-12 09:28:00
179,22,Democratic minute fire recent black fact include last order media.,2025-12-23 00:45:50
180,403,Town within approach gun collection that water dream game.,2025-12-19 12:53:35
181,201,Official message thus ground walk particularly able glass wife catch.,2025-05-20 02:56:28
182,281,Magazine lay stuff both rich speak civil say tend.,2026-01-23 08:37:16
183,7,Easy price senior black piece key woman loss beautiful.,2025-07-07 07:26:49
184,131,Check agency play bring senior role probably test.,2025-06-30 21:13:10
185,28,Professor rock speak dog else important look heart.,2025-04-09 22:40:49
186,44,When difficult run we around summer.,2025-10-16 22:38:43
187,206,Two behavior explain social though after term official campaign thank.,2026-01-17 07:44:59
188,282,Live produce people side operation watch show you.,2026-03-16 12:07:22
189,148,Thousand company paper concern thought marriage.,2025-06-11 18:37:24
190,268,Around enter smile late suddenly staff amount six drug best coach.,2025-07-29 09:00:25
191,295,About player move mother reach civil real.,2026-02-18 22:56:48
192,3,Western skin education action claim nature bank entire team nature.,2025-11-16 06:52:39
193,222,Off tough leg air form cold indeed save rule yeah.,2025-12-24 13:37:05
194,113,List although between argue blood tough life such.,2025-12-04 14:14:21
195,438,Why prevent old hard their here total peace public century begin ability per.,2026-01-20 10:18:25
196,47,Material poor marriage what ahead around in girl common nearly large generation tax account.,2025-09-18 09:22:28
197,437,Particularly modern decision each including indicate manager.,2026-02-07 18:45:06
198,73,Federal Mr value listen school likely skin possible with up.,2026-03-02 07:43:58
199,48,Sign pick baby everything word claim.,2026-03-20 02:36:37
200,223,World gun able already own customer drive detail direction.,2025-10-27 06:03:44
201,336,Garden have summer cold various manage factor yard interest according food administration than.,2025-12-03 15:02:39
202,284,Serious open husband process remain realize network.,2025-12-23 12:30:56
203,363,Group prove foreign information employee past.,2025-11-01 14:29:49
204,119,Hand dark consider fight under play natural simple.,2025-04-08 02:07:56
205,321,Alone finally list point painting marriage necessary television base civil relate cost.,2026-01-19 05:32:17
206,401,Total thus size expert teach teach return eat page trial.,2025-09-20 09:51:07
207,3,Especially whole lay unit him time white two view former new several sign tell.,2026-02-05 09:25:14
208,188,Paper few five arrive debate east similar less measure this network my security.,2025-08-05 01:08:52
209,31,Country factor media at production traditional administration rule bad because.,2026-03-19 16:12:11
210,447,Song myself tough someone share put research to blood audience thought near.,2025-08-25 07:30:51
211,429,Sound ok PM science cause there wife pick know do strong tell wide.,2025-11-02 13:45:26
212,471,Hit agency significant side protect stay claim west man realize.,2026-02-07 21:10:15
213,154,Check management organization exactly second maintain music hard baby half plant ever.,2025-09-20 07:03:20
214,342,Hear serious air one however word name generation test pay rest whom.,2025-05-01 17:28:49
215,130,Parent other summer trouble share method of son later room size past myself listen.,2026-03-19 07:34:48
216,42,Player right dog energy turn join science Democrat rest.,2026-02-02 07:07:53
217,441,Green help final reveal Congress great present political relate notice.,2026-01-09 16:30:16
218,426,Support street man fall radio college economic firm store check its.,2025-12-23 20:07:16
219,234,Pick serious arm policy simple shake account.,2025-07-07 13:08:53
220,93,Thing personal wrong professional garden school grow plant other husband fact.,2025-04-08 20:35:36
221,377,Visit yeah at simply us would bag federal.,2025-11-11 11:17:38
222,172,International against Mr either same like.,2026-01-07 14:09:45
223,37,Country public authority manage expect pretty you trial would suggest build almost mention.,2025-05-23 07:30:06
224,473,Professor sport remember win bill wish station.,2026-02-04 11:49:01
225,321,Live live which myself event several.,2025-07-17 21:46:01
226,156,Follow once green several again drop accept wonder if picture water some.,2025-08-01 23:32:23
227,189,Trade true avoid bag oil type thousand guess.,2025-07-06 00:11:58
228,483,Church interview capital follow population from push issue.,2025-12-03 12:20:29
229,257,Between ready summer college short bad personal social also market should food approach accept.,2025-08-30 03:36:40
230,48,Own chair clearly far sometimes ok after out.,2026-01-26 13:17:59
231,441,Offer enjoy discover ok miss affect administration.,2026-01-25 22:08:49
232,418,Degree give manager run into value since know investment itself attention.,2026-01-06 03:54:35
233,5,Fine pay air understand white local international.,2025-11-24 09:33:07
234,496,However player may thousand allow yourself local his little.,2025-09-06 15:46:14
235,195,Try dinner pressure impact ground third vote camera wonder.,2026-03-24 00:04:22
236,370,Point senior toward per choose that admit trouble reflect everything.,2025-11-30 02:18:12
237,14,Move experience over term third join.,2025-11-05 00:29:38
238,7,Explain once Congress modern business every art likely foreign apply.,2025-11-20 02:39:07
239,77,Friend serious require describe none class back method.,2025-11-26 15:39:02
240,72,Wind environmental mind three view child else trial raise almost.,2025-07-03 09:22:30
241,285,Thank unit stand anything either street.,2026-01-23 18:55:57
242,180,Close suffer likely risk candidate ability sister go.,2025-09-28 23:30:26
243,372,Finally light federal must provide pattern class all article price.,2025-08-08 23:51:00
244,318,Different same these bring bag around environment for increase.,2025-07-16 14:00:03
245,333,War plant natural performance more although series knowledge.,2025-04-28 17:49:24
246,424,Evening power some account man specific option worker.,2025-10-31 08:31:03
247,462,Hope institution rich chair challenge effort especially.,2025-11-13 05:06:28
248,142,Kid likely central drop consider firm attack.,2026-03-07 12:01:32
249,140,Wonder determine adult power buy born detail prepare.,2026-03-17 17:49:15
250,142,Director line partner offer there hotel plant evening level return professional major be.,2025-04-28 21:00:15
251,12,Mrs alone upon fall hot information rather leave easy fly.,2025-11-03 11:25:26
252,263,Reveal college song much community officer much team.,2026-02-12 11:38:55
253,23,Real spend sea travel only believe since company place serious who attack during.,2025-06-25 15:34:45
254,186,Forget yourself nor type themselves professor.,2026-02-23 00:15:31
255,424,Sea ask sound accept remain bag over morning hot ground hospital try conference east.,2025-05-20 01:51:41
256,370,Maybe look also decision seat enter.,2025-09-19 00:32:24
257,396,Response technology standard area customer reduce plant identify.,2025-12-28 10:03:31
258,262,Reflect industry specific college news notice.,2025-11-14 03:52:34
259,472,Table tough he describe add sport loss ahead coach beautiful.,2026-01-19 06:59:07
260,1,Eat beyond small may water necessary someone exist.,2025-05-16 23:52:34
261,212,Game scientist while technology lead last same approach pressure central space.,2026-02-26 03:46:55
262,336,Bit small term book must research share he.,2025-05-15 02:30:06
263,151,Meeting west check recognize second mind.,2025-04-01 11:35:46
264,392,Turn sound any risk when chance consider involve choice.,2025-08-11 08:14:11
265,202,Step security line age conference hour through include why.,2025-09-19 23:11:36
266,266,Result hear long sort building sister same argue town exactly production.,2026-02-03 14:27:08
267,96,Evidence citizen couple source not very particularly attention must government medical commercial million.,2025-05-22 13:09:32
268,226,Social race accept program stuff Republican care strong.,2025-05-05 17:13:26
269,372,Learn growth like miss around present kid provide science his expect point performance.,2026-02-10 20:22:17
270,67,Idea particularly food cold fear data like event.,2025-05-30 13:42:30
271,390,Cover reality within program only exactly science state whose type edge push simple.,2026-03-18 01:56:38
272,498,Politics a always along must factor professor sell any might edge.,2025-06-14 19:51:52
273,279,Learn mention current fall hotel follow relate no be nature.,2026-03-13 19:48:49
274,456,Sit food space leg small social act say boy hair movie three consider.,2025-11-29 13:09:44
275,262,Read recognize century charge task special billion yeah visit billion while.,2025-07-31 23:35:06
276,152,Shoulder improve whether child require green.,2026-01-21 06:35:18
277,380,Structure fill side simple quality great allow as team behavior president catch.,2026-03-06 18:41:48
278,322,None beat business commercial soldier simply eat.,2026-01-27 23:29:04
279,248,Guess eye nor near free phone tend care perform million and enough.,2025-06-23 00:31:22
280,378,Choose especially not number health consider open building dog until character song see.,2025-11-10 14:20:23
281,345,Teach sound someone for garden product draw not party religious every.,2025-12-22 23:54:59
282,178,Soon trip theory stand want across doctor.,2025-12-27 16:57:39
283,264,Forget very cost able admit knowledge.,2025-09-18 17:10:39
284,233,Over hot reflect something thank responsibility various president other item huge agree rest.,2025-12-22 12:53:02
285,64,Action public sign candidate share general anything where much ahead marriage.,2026-02-20 01:19:01
286,118,Current or either interview age generation fear car quality.,2025-05-31 18:03:12
