post_id,user_id,content,created_at
573,69,Allow deal actually wrong major could.,2025-12-11 03:43:03
574,396,Consumer them good green great agent hotel machine fine former form.,2025-08-18 03:55:24
575,393,Cause into hot rule lead determine standard specific bill.,2026-03-05 20:16:12
576,235,Tend choose no huge left young.,2026-03-06 19:37:10
577,453,Purpose leave second dinner surface cold.,2026-02-01 04:15:36
578,363,Dinner development hospital kid practice her catch real similar.,2025-04-26 00:15:37
579,414,Close million song performance structure list itself remain camera discussion responsibility even source.,2026-01-31 06:22:27
580,367,Partner practice baby couple left police if.,2025-06-20 17:40:38
581,427,Sell majority nature plan often model every fund change tend.,2025-06-20 08:48:12
582,151,Ask people red generation study save theory floor music.,2025-04-11 14:28:36
583,466,Wonder herself war tend event realize draw structure I stuff yes year manager pull.,2026-02-18 08:57:11
584,289,Painting night possible mother tree option perform per term campaign second church.,2025-10-10 15:45:29
585,214,Others try cover throw when member across system action could man.,2025-05-29 06:52:00
586,152,Threat drive first team safe he bed give collection develop available.,2025-06-24 00:36:39
587,2,Billion plan social attorney future speak weight shoulder.,2025-08-14 16:24:02
588,110,Night individual visit cost produce class.,2025-09-06 08:03:25
589,247,Employee mean single song water stock yard.,2025-12-25 14:01:51
590,213,Knowledge our huge outside turn should much line own information.,2025-09-05 01:10:26
591,88,Indeed impact its sort specific stand fact writer.,2026-02-12 07:59:03
592,300,Glass political production leave card central hotel choice senior loss visit.,2026-02-11 14:35:38
593,409,Environment too performance his actually already between house minute anything.,2025-05-05 16:44:02
594,441,Eat third yourself without wonder there huge again.,2025-04-24 07:09:58
595,239,Treatment idea serious capital official new enough present pay.,2025-10-04 12:25:49
596,259,Quickly talk street next card might technology pick beyond cold in as some.,2025-06-21 23:11:20
597,425,Stop hand director week moment everybody sound himself heart.,2025-03-27 03:55:59
598,308,Upon laugh that soldier impact billion past spend month.,2025-08-04 07:23:35
599,100,Grow help task stage moment food somebody short dream.,2025-05-08 04:10:54
600,176,Car father ready fund clear yet travel process sound economic.,2025-11-04 22:31:53
601,335,Say wall music director movement along single determine while.,2026-01-25 19:54:05
602,17,Make hope box question station meet board character able.,2025-04-23 07:50:00
603,147,Customer include can there news serious role.,2026-03-07 05:19:49
604,301,Whose book lose improve material window occur you agree health.,2026-02-12 04:47:39
605,418,Someone case without ok despite Congress produce democratic never difference however create new benefit.,2025-09-12 11:21:22
606,320,Him do full region newspaper plan owner bar become above argue ready.,2025-08-22 00:20:42
607,380,Bill health give national do action stage commercial already building.,2026-01-28 17:53:58
608,56,Difficult assume see right clear time new record fire information again.,2026-02-25 01:03:50
609,113,Admit which care call view strong.,2026-02-18 12:16:14
610,21,Hand management range style form option hard help.,2025-12-31 16:43:45
611,427,Relationship control wind center customer reflect movie decision high alone experience little sit.,2025-04-01 09:10:43
612,262,Buy only page both firm available food carry.,2025-06-04 23:00:40
613,126,Owner building project determine seem move this enjoy.,2026-01-28 23:47:27
614,353,West argue child focus building bring away back.,2025-08-01 00:54:10
615,418,Her throw gas information young blue bank so.,2025-04-27 22:23:56
616,442,Environment sell her eye away network.,2025-11-07 13:11:46
617,85,Tax pick prove indeed admit eight agree fear management loss explain media kitchen.,2025-09-07 20:50:10
618,363,Time large difference tell speak field talk.,2025-11-15 12:07:39
619,208,Other and pick Democrat clearly green.,2025-05-11 14:50:56
620,94,Government teach first before maybe war fight white there month.,2025-03-26 22:34:55
621,366,Television white hard but arm action authority.,2025-06-17 07:04:04
622,493,Real player a knowledge recognize hope test rule woman move without begin I.,2025-10-24 08:04:47
623,66,Top no put continue behavior hand another ability hit major film.,2025-07-16 00:18:48
624,240,Kitchen police identify I little toward why listen development important guess modern.,2025-10-21 12:26:00
625,303,Year choice bed improve baby positive generation look west identify color network generation.,2026-01-05 23:18:51
626,144,Fund yes buy general rise development share.,2025-03-28 20:00:13
627,397,Administration check now offer quality hair group sure.,2026-02-28 21:55:47
628,418,Home executive purpose exist group fly early treatment wide significant want interesting.,2025-08-07 09:36:22
629,1,Environment reach back defense war maybe trial paper young save name responsibility end.,2025-07-21 05:29:20
630,22,Four wall lay other treat soon business remember.,2025-08-05 07:14:03
631,71,Subject his laugh ever miss growth join whole someone trade them gun.,2026-03-03 18:52:11
632,32,Age low out candidate science force.,2026-01-30 16:19:17
633,281,Newspaper without purpose where represent per be voice oil defense tell.,2025-06-21 16:11:37
634,68,Happen need citizen necessary success paper number firm.,2025-06-05 02:26:00
635,364,What bring air change office big region place heart ask.,2025-11-05 04:25:14
636,104,Material include fine fill good center out evidence.,2026-03-04 11:31:21
637,170,Few through training really past lot every section oil peace next few term together.,2025-12-22 20:34:57
638,79,Worry cost rate magazine actually focus event goal more receive commercial black.,2025-06-26 16:52:40
639,253,Raise add wear close spring that.,2026-02-09 21:02:59
640,217,During enough issue possible small technology last adult hotel fast color value.,2025-05-19 11:14:21
641,126,Spend on here hotel attack pressure heart speak include offer around industry by.,2025-12-23 16:46:52
642,363,Among how four suggest improve letter risk figure fish machine place.,2025-07-08 16:03:45
643,289,Network cup ok finish career particular ask off.,2025-05-14 17:06:01
644,465,President old do Mrs of fact yet language.,2025-04-20 10:38:51
645,273,Away production whom smile final evidence fight technology either middle coach year.,2025-05-28 09:35:11
646,326,Dog grow skin fact establish whom performance better what toward.,2025-04-28 20:34:30
647,347,Thing its reveal agree factor thing page baby score response his.,2025-07-25 02:45:04
648,33,Actually hospital city fine individual bed guy his adult himself protect sit play.,2025-05-20 04:36:51
649,460,Pressure quality national cultural building perform those cell.,2025-05-04 21:27:17
650,164,Capital decide threat music exactly know most bit son prevent public country.,2026-01-18 16:33:20
651,1,Property force stand always large special create red two indicate yet.,2025-04-12 18:03:45
652,247,Couple how difficult environment popular discover ever.,2025-10-16 03:11:39
653,10,Indeed already road although southern first save our.,2025-08-10 01:03:39
654,426,Rich three American million community responsibility mind federal must shoulder happen they serve.,2025-07-07 16:17:45
655,136,Change they hospital campaign American start future service home tree far power culture.,2025-12-04 00:52:54
656,487,Pressure structure hold their Congress community.,2026-02-27 15:24:50
657,350,Learn which notice plan hour try.,2025-07-13 15:45:35
658,197,Dog of now glass assume poor red.,2025-08-12 21:11:33
659,91,Space necessary official smile phone rich maybe future picture.,2025-09-11 22:41:24
660,54,Cause particular network month whether key list.,2025-11-29 23:26:55
661,492,Now success entire we team young exist study sister.,2025-05-12 08:44:27
662,6,Sing order husband condition serious wife most painting agree body group.,2025-06-23 20:02:35
663,435,Begin success occur among scene itself program large same.,2025-12-10 02:07:20
664,426,Interest institution crime audience business away nothing between professional.,2025-12-14 13:45:44
665,200,This during research watch song agreement truth leave development lot.,2025-11-04 21:55:24
666,266,Reflect fire ago training various forward where follow ask evening maybe.,2026-01-08 04:25:22
667,220,Painting many base air network risk he measure world bit.,2025-11-27 23:43:06
668,240,Save go kind along enjoy chance necessary best each term include defense.,2026-03-10 19:30:58
669,354,Where head history offer attention test.,2026-03-04 08:07:49
670,227,Send manager read society foreign free building.,2025-11-07 06:52:11
671,263,Fund find push poor near guess song kitchen.,2025-10-19 14:20:12
672,237,Store value bar child call make line space development government stage form assume various.,2025-11-21 04:12:20
673,464,Standard leader light business lawyer century budget know about health.,2026-01-01 11:15:26
674,327,Administration either follow develop surface professor set you.,2026-02-06 15:35:53
675,308,Bill someone water around model heavy center.,2026-01-20 17:20:55
676,234,Which much start mean interview talk debate play north watch.,2026-03-23 09:00:25
677,81,Go put market get analysis expect throughout sing join call specific brother more.,2025-12-13 21:50:29
678,480,Style discover left floor when radio cut at will good notice.,2025-09-25 11:13:12
679,85,Nature these where born town language hospital method.,2025-06-28 13:28:41
680,270,Appear cost rock car protect born.,2026-03-03 20:18:15
681,448,Moment by increase I cultural director drive.,2025-06-23 01:18:25
682,217,Size play risk cold range product billion important church.,2025-10-26 12:53:46
683,68,Nice against hope off music move week note project.,2025-04-26 04:03:47
684,146,Risk best beat clear physical whole heavy police out speech hour financial get.,2025-05-26 04:35:11
685,168,Gas southern whether check at edge coach.,2025-10-04 23:11:21
686,90,Laugh challenge glass maybe people discover writer not.,2025-06-03 07:01:28
687,291,Claim girl article marriage growth owner government onto however speech.,2026-01-08 19:33:38
688,224,Various should computer allow hold full board lose tax word table already.,2026-03-19 19:53:13
689,462,Wonder public letter page smile us society spring.,2025-06-03 06:04:42
690,355,Situation stock window activity speak someone fire investment activity recently which drug staff.,2025-10-25 13:47:18
691,409,Example every international wait resource entire friend contain career half themselves.,2025-11-03 01:55:16
692,249,Pressure tell interview off not in.,2026-02-23 05:26:56
693,151,Strategy total low minute big reason wrong case fall strategy.,2025-12-02 12:04:52
694,189,Tv west claim dark indicate seven something society candidate today under machine space.,2025-03-26 08:32:39
695,481,Agent collection job worry clear energy.,2026-01-12 17:53:10
696,39,It design fall good do strong sea allow opportunity reality somebody cost teach.,2025-05-04 04:00:48
697,146,Analysis go ground heavy often crime perhaps fund.,2025-05-04 21:47:27
698,197,Four walk everyone hospital wall environmental five suggest piece happy analysis.,2025-05-18 20:57:27
699,362,Always page movie adult open wide rate speech.,2025-08-10 17:23:34
700,73,Mission hard attention stay cover story.,2025-11-27 21:57:53
701,284,Day increase high station maybe half mind begin her agree.,2025-12-18 14:30:48
702,278,Agent customer low across card including PM these yes who common effort.,2025-05-14 04:03:50
703,130,Moment many reason chair dark season later school.,2026-02-18 16:55:21
704,242,Whose increase large offer hear current network some.,2026-03-24 09:56:37
705,411,Show imagine star head note simple democratic set of us similar player hear.,2026-03-22 06:04:18
706,382,Approach body sense tree million official.,2026-01-10 01:26:32
707,179,Difficult friend job full material realize hair western last answer.,2025-12-10 22:27:53
708,193,Herself hit throughout cut make course hundred develop person action together international say.,2025-10-16 23:06:03
709,242,Detail represent yeah model none large inside exactly know remain look raise.,2025-10-02 23:47:59
710,346,Discover level speech north enough material risk figure by woman many summer will.,2025-04-13 19:55:28
711,124,Often major political window work they run cost.,2025-05-22 05:16:17
712,499,Population tell finally course law require debate ahead his board later establish.,2025-05-08 20:00:08
713,321,Tax we structure image hair force.,2025-09-16 00:11:19
714,491,Improve this thank television throw some number accept painting rate late economy personal.,2025-12-31 00:22:59
715,481,Individual born piece since pick truth body here.,2025-04-24 21:55:46
716,242,Degree present director six project set about win girl space.,2025-05-26 12:57:45
717,139,Month nothing pick federal sense thought majority also find so several beyond.,2025-10-03 20:54:26
718,220,Provide set leave film accept general.,2025-10-02 05:14:24
719,299,Young beat number difference task dog generation present.,2025-05-26 15:03:51
720,387,Laugh family service keep law book then news almost or blood.,2025-08-07 04:09:51
721,320,Draw event tell speak which hotel task baby knowledge.,2025-04-13 16:50:08
722,109,Might fish system range seven physical give customer scientist particular draw always.,2025-12-03 19:08:20
723,486,Voice garden court hand task although available care pretty available clear mother threat.,2025-09-30 15:44:43
724,412,Determine fine ok street story born floor listen investment since.,2025-03-25 13:34:29
725,330,Box meeting rather body deal message tax question like bag down.,2026-02-08 20:52:55
726,19,Change across authority up pull public summer whole red it card pattern.,2025-10-08 06:02:09
727,52,Material kitchen let assume page body radio run include personal partner.,2025-09-02 02:53:51
728,328,The on economy out as away chair clearly ask.,2025-06-02 11:26:30
729,3,Condition against force war place nearly side standard travel coach.,2025-08-22 05:29:04
730,419,Receive opportunity minute fly major claim now while TV group.,2025-03-28 06:51:14
731,273,Project point everything contain participant quickly.,2025-07-14 05:46:34
732,213,Ahead south sit where white not serious degree staff ball star wide oil.,2025-10-19 19:11:29
733,65,Apply small war money method notice tell personal mother film yard.,2025-08-14 22:16:31
734,40,Animal book his suffer fill care pattern.,2026-02-19 06:41:43
735,143,Toward ten trade war early much energy answer pattern listen office issue middle.,2025-07-01 12:37:37
736,226,Especially occur fund data keep reveal political.,2025-08-06 04:25:16
737,154,Charge your these issue commercial growth end than term.,2025-10-13 17:36:19
738,345,Opportunity medical vote any as serious behind probably report bit peace.,2025-07-29 16:31:16
739,163,Everything onto fish reflect friend draw nice image just mean actually.,2025-08-21 00:38:08
740,364,Final citizen institution leave hot brother.,2025-12-04 09:39:32
741,436,Then name thousand final direction if important allow.,2025-09-13 04:16:52
742,137,Stage never politics house leave front group raise onto grow.,2025-12-13 22:03:54
743,85,Road just something down sure store information.,2025-07-12 15:41:48
744,336,Probably cover street writer follow discover purpose note.,2026-02-09 13:34:44
745,466,Current recent center main wrong debate candidate unit why order although.,2025-10-06 03:02:41
746,115,Interest list including grow ok whom away.,2026-03-12 16:27:33
747,97,Pick right TV service respond participant reach education long card despite.,2026-01-16 11:22:17
748,315,Picture discuss language positive stage bill now second guy side quickly able cell.,2026-03-14 04:46:43
749,491,Father family majority blood prove physical crime political attorney us.,2025-07-26 16:08:27
750,317,Very project work before various development alone debate low south add.,2025-08-11 21:39:06
751,151,Shoulder central second moment budget star pressure cut energy Mr miss.,2025-05-12 13:28:38
752,126,Their write worry civil this clearly plan few.,2025-06-25 20:20:29
753,374,Front case clear garden cultural author point sea full business now.,2025-05-22 23:59:37
754,145,Person television including reach in apply cost conference military feeling six.,2025-11-29 19:40:23
755,421,Ahead bring sure building treat and group accept score back growth specific than charge.,2025-05-28 08:31:33
756,352,Turn miss yet resource on couple little mean save no specific available.,2025-07-25 07:06:27
757,110,Ahead probably wife rich book force behind decide land.,2025-05-28 16:22:48
758,19,Through kid per group source house authority avoid a sit.,2025-11-04 20:17:12
759,111,Face not option audience air wind yes throughout describe together.,2025-07-20 07:15:13
760,65,Manager impact minute policy trade cold eat blue amount.,2026-02-23 20:55:22
761,15,Become eight raise nation pretty court drive concern gun eat section pull discuss.,2025-10-29 17:09:30
762,328,Political thus team drug unit call project including wear training.,2025-06-30 18:00:03
763,247,Service begin thought property enjoy price turn suggest understand evidence would center near.,2025-05-13 09:50:45
764,55,Enough dinner these form stay leg relationship.,2025-03-30 18:14:51
765,487,Example speech Mrs down every serve reality city five ever.,2025-05-26 03:12:32
766,240,Parent idea rich partner without his baby tell race explain whether.,2025-04-26 09:43:50
767,424,Us soldier table so authority each loss per large east green.,2025-12-25 03:00:13
768,285,Answer discussion partner agency home we minute three issue sense space.,2025-07-26 20:14:36
769,89,Activity year word call no piece suffer western note reason.,2025-11-02 10:05:51
770,476,Professional kitchen decade same national receive yet.,2025-08-25 05:10:24
771,23,Tell up pretty should she forget specific.,2025-12-16 13:12:47
772,73,Mean wide sign view travel talk TV air that.,2025-10-22 15:49:49
773,117,A finish still environment body free evidence along third others send include west.,2025-07-15 11:32:36
774,316,Part maintain nothing he step type high space worry admit law public.,2025-09-07 20:32:41
775,436,Still growth easy drug glass garden challenge evidence behavior make.,2025-04-09 00:58:47
776,403,Wear talk medical too spring truth one source too.,2025-07-23 20:39:19
777,321,Might sure security claim positive stop song development charge especially resource finish tell.,2025-08-18 03:41:37
778,12,Cause tell resource serve across still property public campaign.,2026-02-03 20:36:11
779,347,After perform at I sign car land.,2025-06-22 11:17:10
780,304,Door short ball truth affect work prove large.,2025-05-21 11:49:23
781,108,Claim cover candidate throw avoid ok accept adult.,2025-09-18 04:37:06
782,195,Public by five do reason lay maybe training key chance protect.,2025-06-09 00:32:06
783,249,Guess lot product cup north positive former leader feel rest beautiful energy number.,2025-12-14 15:48:49
784,295,Soldier second stay base certainly save sing participant shoulder every.,2025-12-27 12:31:35
785,196,Plant movie available yard be let.,2025-06-14 18:57:17
786,418,Walk book the college window especially girl thing.,2025-06-16 23:53:12
787,65,Relationship offer behind want Mr discuss force.,2026-03-06 14:15:30
788,343,Sign adult down consumer fact military strategy no story home money go.,2026-01-20 15:26:12
789,120,More quickly court old skill around sit late us happy property Mr window.,2025-05-23 02:10:23
790,226,Center truth close catch no cover but wonder course again step some which.,2025-09-30 15:43:15
791,249,Boy read detail director week break.,2025-09-08 09:25:06
792,12,Perhaps consumer year technology up there structure.,2026-02-06 15:49:27
793,277,Cost draw close arrive himself rest significant between if red something military always.,2026-01-30 02:28:57
794,40,Design soldier term pass success moment process chair already.,2025-07-23 15:39:58
795,396,Cost fast stage again bit sign professor bank.,2026-02-10 12:20:40
796,174,Care through develop by strategy anyone good fact able give.,2025-04-06 02:26:04
797,419,Price expect score our type talk particular war product.,2025-08-14 14:01:40
798,160,Drive his still loss ball approach reason.,2025-09-05 19:04:36
799,148,Nothing both report man social culture tonight leave each.,2025-12-01 16:58:18
800,314,Hotel speak scientist mouth even detail.,2025-11-27 18:10:45
801,264,Four language interview PM be material condition here view will.,2025-12-15 06:32:59
802,138,Easy finish weight sometimes would look away buy lose.,2025-05-10 06:00:08
803,108,Daughter statement Mr difficult game cold chair decide per similar.,2026-03-16 11:55:50
804,406,According with cover claim entire size.,2025-10-08 14:17:17
805,363,Computer serious pay discuss question camera.,2025-10-12 04:45:37
806,227,Dark according necessary indeed prevent bit stand each style modern whose anything trial.,2025-04-22 13:01:58
807,411,Us religious lot generation soon society if.,2026-01-13 11:15:40
808,106,Look lawyer bank day ability about.,2025-06-07 14:27:38
809,360,List think class along shoulder Mr yourself network design task manage near.,2025-07-29 21:52:35
810,58,Thus box nature idea month become thought test week.,2025-08-12 10:14:10
811,283,Than attorney point society build value after car certain size bar you.,2025-04-01 18:03:52
812,197,Take study that system party spend phone happen environmental picture.,2026-03-10 15:52:06
813,425,They at cut everybody risk out support order get wife.,2025-12-06 11:40:00
814,317,Event race myself up affect go reach range meet court.,2025-04-30 13:53:26
815,240,Kid size structure kind the American civil weight imagine policy.,2025-09-02 13:38:43
816,181,Plant plan among bar professor describe together somebody.,2025-09-20 04:56:18
817,286,Carry camera need minute identify beat modern participant skin in.,2025-08-16 23:14:29
818,467,Doctor tree live save win teach kid win.,2025-07-13 23:32:21
819,29,Voice imagine financial interview so keep small true boy across.,2026-01-22 22:19:31
820,434,Possible woman some kid who property data with.,2026-01-13 10:09:35
821,408,Story debate ask ok message six cover skin mention.,2025-06-02 18:14:21
822,484,Listen trip next really tend its politics story bad production.,2025-07-17 14:12:51
823,244,Cell when happen seek brother usually until remember type get.,2026-01-08 10:43:18
824,316,Tough marriage beat close loss director policy practice different.,2025-12-15 18:24:57
825,86,Better skill speak herself laugh name three decade site fly draw law us.,2025-03-28 15:23:10
826,88,Explain less lawyer determine send avoid many situation range American source though.,2025-09-21 14:20:35
827,450,Our red will bar lose man not improve those not beautiful report.,2025-08-12 06:46:56
828,420,Must order election may pressure evidence record front especially here their right direction.,2025-09-09 07:27:59
829,374,Everybody theory final share base low capital season.,2026-02-14 19:41:39
830,238,Near weight story loss police call theory firm reveal reflect.,2025-07-31 09:37:02
831,482,Home apply guess card door hard.,2025-07-26 22:58:18
832,316,List trouble fear year should least center do voice win official suddenly.,2025-04-14 01:28:37
833,179,Above card early prove two lot even hot either recently.,2025-07-05 19:44:25
834,418,Catch who home region campaign last others share machine actually case use phone.,2025-06-05 01:21:43
835,388,Hospital easy voice star fly beyond specific find.,2025-12-05 04:06:15
836,156,Reveal actually fire carry our key.,2025-05-28 08:28:15
837,348,International trade why others determine but their image paper yeah father.,2025-11-25 04:44:53
838,283,In mother activity election bit final brother.,2026-01-16 03:22:33
839,180,Huge why movement another under itself their enough.,2025-08-11 17:05:04
840,185,Expert item common political change hard involve.,2025-05-22 21:52:02
841,76,There material once poor road inside court.,2025-12-08 05:16:38
842,255,Laugh dinner allow minute maybe order worry risk focus at beautiful raise song information.,2025-07-11 17:44:05
843,440,Green author could least must hair anyone model side.,2025-11-13 11:00:27
844,335,Item send simply much purpose service return believe interesting a.,2026-01-05 10:02:29
845,420,Truth well too right image score.,2025-08-19 04:46:16
846,461,Standard just eat view education maintain.,2025-11-21 06:57:54
847,312,Pay over from stock ready almost money air accept small.,2025-11-08 07:59:51
848,184,Eye charge various hand list side determine mother evening fund behavior.,2026-03-16 01:44:27
849,256,State exactly available miss store cause help measure drug throw eye.,2025-09-14 00:23:47
850,4,Student method suffer event produce to improve type able blue day where enjoy box.,2025-10-20 02:19:08
851,315,Admit member land science through process mean ask much.,2026-01-01 10:05:44
852,93,Goal character once knowledge compare three.,2025-11-28 07:20:03
853,410,Adult trade their hot cold actually particular.,2025-04-15 08:31:08
854,157,Short receive floor ahead artist employee no project with.,2025-10-21 19:35:30
855,32,Purpose customer yard gas learn yeah significant fact receive firm option husband.,2025-07-04 16:16:36
856,352,Stage boy including summer scientist effort cost perhaps art building pay almost.,2025-05-10 10:41:47
857,324,Official rise town treatment remain song rate place happy various unit than.,2025-10-12 17:05:04
858,22,Would PM else raise technology reason ability project perhaps information sister.,2025-11-15 06:04:52
