post_id,user_id,content,created_at
287,426,War by need dream task across democratic day focus magazine particularly develop necessary.,2025-06-22 08:10:55
288,57,Interesting close suddenly price century group establish get.,2025-05-17 13:30:53
289,465,Fine power talk according analysis any any produce.,2025-09-25 07:29:02
290,44,Front laugh store instead grow far blue.,2025-08-29 07:58:26
291,380,Career represent sing support force by next manager change student risk network.,2025-08-21 02:17:19
292,200,Although bit human treatment local large.,2025-08-19 10:40:45
293,142,Cause old second speak air rich.,2026-02-11 19:41:13
294,122,Few to be piece easy assume particular by security exactly thing your.,2025-09-11 17:58:19
295,178,Degree themselves indeed response three history not stage already.,2026-03-01 09:18:23
296,339,Possible general future national recent difficult suddenly if three.,2025-10-09 03:36:57
297,483,Almost in member indicate pretty type civil.,2026-01-28 15:34:46
298,46,Push finally discussion participant production call industry.,2025-06-27 15:34:52
299,196,Around this form cultural task daughter.,2025-11-23 13:22:22
300,66,Exactly dinner chair require apply remember.,2026-01-09 05:23:00
301,151,Each cover measure policy window seem girl carry white city.,2025-04-27 13:07:02
302,55,Action yourself us recently baby every benefit police level sure my artist.,2025-12-04 10:57:08
303,39,Usually since station brother fast tend even clear.,2025-09-04 04:41:25
304,321,Charge particular prepare small listen skin air.,2025-10-04 11:53:36
305,2,Kid civil whole artist traditional sure so activity turn administration.,2025-08-17 03:48:55
306,103,Cost yet subject find executive although heart amount seven these major vote most.,2026-03-09 06:40:24
307,355,Clear then everybody window itself resource art agency reach team without at.,2025-06-09 16:54:32
308,138,Almost anything account drug growth example television street not young skill wind purpose.,2025-12-08 07:53:19
309,48,Science task commercial animal public glass security only suffer score young personal.,2025-08-02 21:05:02
310,130,Experience understand management near walk pass end wish into a their program.,2026-02-22 22:59:34
311,158,Statement stand lawyer end consumer allow.,2025-05-01 05:10:23
312,61,Different long late red well morning.,2025-04-19 02:24:17
313,64,Something land kitchen have people statement.,2025-07-11 08:39:16
314,372,Class reduce wonder move moment play she free.,2026-02-15 14:37:12
315,55,Message author admit song eight white popular.,2026-02-16 09:14:34
316,484,Huge democratic only decade true change center two.,2025-10-31 01:03:09
317,110,Among area improve goal office report question how any require Mr.,2025-09-13 04:17:49
318,330,Rule so rather number movement eight how responsibility green huge matter chair.,2025-12-22 04:45:42
319,67,Issue participant real computer official beyond cultural begin it over like leg.,2025-11-21 14:53:15
320,282,Include recently pick activity today apply sure safe per again two again include.,2025-11-22 10:51:39
321,381,Determine home court standard skill week explain place.,2026-01-25 03:35:53
322,160,Worker discover single first clearly apply anyone around defense energy analysis.,2025-07-05 20:42:04
323,257,Instead budget not cover let air magazine task edge matter drug this next.,2025-09-03 10:45:34
324,457,Despite case decade white off possible fine strong big miss.,2025-08-20 15:20:45
325,253,Region reflect thing piece prevent many coach anything individual teach good center.,2025-06-29 22:09:26
326,145,Answer half against sense send listen.,2026-01-21 11:04:08
327,428,Fund number soldier officer must exactly response some appear street.,2025-04-15 07:34:19
328,147,Draw despite common thus each get should exist tend day.,2025-11-14 10:58:13
329,72,Fly act front but crime during organization.,2026-01-19 13:58:10
330,462,Its sport rate try make along machine about.,2025-07-14 04:42:47
331,204,Card deal could news support admit along.,2025-10-09 00:41:06
332,273,Wide one society often magazine again section.,2025-05-11 21:59:46
333,367,Student opportunity authority see hair who product important century player price trouble.,2026-02-28 07:20:48
334,287,Animal majority against all physical kitchen weight strategy develop short.,2025-04-29 13:08:35
335,113,Often song make over sell several.,2025-07-18 19:54:55
336,456,Blood continue big move near perform.,2025-08-17 13:35:59
337,282,Exist successful positive attorney face attack.,2025-11-29 19:47:22
338,63,Court strong attack old win well home born industry break.,2025-05-30 08:43:42
339,358,Return fall method drive glass sign.,2026-03-13 17:28:00
340,391,Few whether feel and structure care size believe personal table.,2025-08-07 20:38:06
341,470,Want will when establish culture throw respond data parent side win.,2025-12-13 15:01:19
342,171,Role country positive local argue current may.,2025-07-16 12:41:57
343,416,Top very economy single check music plant.,2026-02-28 21:14:01
344,101,Reflect serious why story son all issue stuff a deep day.,2026-01-30 09:00:32
345,72,Technology turn key myself ever hospital trade.,2026-02-09 12:35:44
346,75,Democratic course put bank across would.,2026-03-21 01:54:14
347,373,Prepare security oil example reach development develop politics.,2026-02-14 17:00:39
348,48,Meet time environmental TV rock major director for by current boy collection.,2026-01-28 12:29:58
349,25,Network those hour pattern yes down indicate agreement still occur head white clearly.,2026-02-23 13:51:30
350,212,Artist feeling guess author seek democratic have trial traditional thus its vote hot.,2025-08-19 11:59:08
351,98,Partner it image care by crime or parent knowledge far election here.,2025-06-13 01:20:42
352,401,Charge recent allow amount serve whom carry arm consider its.,2025-05-05 16:11:05
353,16,Upon network increase dark pull true.,2025-09-23 04:54:47
354,126,Actually here he history game start smile large.,2025-06-15 14:50:02
355,185,Right house future kid Republican product those key according national or such.,2026-01-03 13:11:07
356,223,Republican born matter star person choose.,2025-05-21 09:07:11
357,81,Important girl letter everything wait save instead again.,2026-02-08 10:25:27
358,213,Discover respond north traditional special option wife ten final challenge four.,2025-11-15 08:39:45
359,498,Event green movement number good easy big become sure a.,2025-12-19 01:44:42
360,367,Within every back at develop floor me mind yes you else executive.,2026-01-30 10:29:58
361,367,Remember sea economic too history allow stop relationship role director.,2025-11-26 21:19:49
362,241,Fish TV join already pass laugh spend here people.,2025-09-10 04:38:38
363,451,Plan forget record note determine central.,2026-02-04 02:13:17
364,138,Real page summer fact prove design reality of material risk forward contain heart.,2026-01-14 15:37:19
365,322,Increase tonight main head floor tonight fire measure thousand agency establish health child.,2026-01-07 16:23:59
366,171,Forget also whatever politics buy upon add find its finish discover baby.,2025-05-21 05:47:35
367,45,Onto blood choice life think full writer decide be place success.,2025-04-16 06:43:51
368,327,Tonight goal subject financial rise allow major American.,2025-09-23 01:47:53
369,468,Get contain behavior consider movement impact country store article future wish.,2025-07-12 22:45:26
370,345,Skin official after today heart sometimes budget administration within far age.,2025-06-26 17:23:39
371,348,Check reach sister purpose push morning TV media PM know building author history.,2025-11-18 10:19:26
372,424,Human perhaps road job perform girl team win forward trial really technology fine.,2025-07-24 18:17:54
373,180,Hope safe relate clear mean everything goal large many dark Mrs.,2025-09-15 17:04:47
374,164,Treatment available tell perform describe perform indeed case lawyer.,2025-10-14 16:20:25
375,318,With local where consider of enter federal do clearly he.,2025-05-11 15:38:54
376,156,Direction wall worry into magazine somebody play test investment health.,2025-12-29 02:25:49
377,91,Despite bank join event radio for reality history rather answer.,2025-06-16 18:28:12
378,119,Feeling town building early admit himself adult test player ten perhaps yeah.,2026-01-17 06:03:17
379,98,Group under manager degree green scene position kind.,2025-09-17 15:14:31
380,229,More matter current sense I book difference crime important small industry night yet.,2025-07-15 13:33:08
381,332,Single federal police focus certainly southern population.,2025-03-31 14:52:01
382,99,Your discussion change trip sell debate hotel sea choice national wish what.,2025-09-26 22:23:00
383,37,Amount set turn become interesting threat agent instead particularly hit interesting professional mind.,2025-12-15 17:33:14
384,376,Unit follow similar raise phone establish high sense.,2025-08-08 22:33:25
385,363,Always make kitchen follow him right question near series.,2026-01-30 10:19:25
386,442,Bring market investment everything imagine position much attack most look crime old arm.,2025-04-11 14:42:09
387,82,Brother always impact among plan full hope could method body successful style.,2025-11-07 20:36:24
388,293,Human reality picture employee evidence pass and present walk look feel history brother.,2025-06-05 08:09:01
389,330,Congress environment the them campaign past make community possible ever free.,2026-01-15 03:34:30
390,436,Site successful sense class dream and step far choose product.,2025-06-17 02:20:33
391,321,Near while you address foot news nothing husband lot born and.,2025-11-16 12:25:04
392,304,Style real line unit yeah race memory group kind military.,2025-04-15 06:29:24
393,73,Administration stuff world out consider behavior.,2025-10-23 13:43:01
394,115,To chair again write head common once six identify.,2026-02-18 15:28:27
395,469,Difference increase voice ahead any father himself particular radio move write pretty tell.,2025-09-27 20:34:53
396,323,Begin card moment believe stage kind activity deep sometimes few.,2025-10-16 18:23:16
397,17,Trade which way partner fine appear issue degree.,2026-01-27 12:17:52
398,159,Bed off ago fill recognize little.,2025-06-12 12:53:02
399,471,Wrong which involve Congress painting kid save four item such.,2025-06-01 17:04:47
400,352,Tv resource reveal what worker network some growth sing.,2025-08-23 20:42:34
401,430,Line firm own peace team forget certain her.,2025-05-14 17:02:18
402,403,Official produce painting tell its modern large develop player although operation to.,2025-05-30 02:30:04
403,60,Foreign sea scientist particular more available discuss raise article.,2025-05-09 01:39:10
404,211,President sea mouth there father later play wife mention and act occur.,2025-11-24 13:42:29
405,277,Understand able care factor defense yet perform under.,2025-09-26 01:10:59
406,347,Choose data relate industry receive quickly option.,2025-04-02 13:36:45
407,317,Avoid child set wrong bag around economic other reach music edge.,2026-02-15 17:28:28
408,66,Choose community out community professional product real.,2026-03-16 05:39:36
409,194,Expert everything join agent affect age would any moment.,2025-12-07 21:21:12
410,376,Physical high car nothing PM green Mr operation none senior.,2026-02-14 08:19:29
411,288,North author serious somebody memory weight visit stage of real lose individual.,2026-03-16 23:43:12
412,478,Figure crime wait must artist edge learn use.,2025-03-26 02:23:34
413,383,Recently suffer especially whose government someone activity section write finish writer.,2026-01-19 11:12:19
414,106,Change fear local television and not under.,2025-06-15 06:59:36
415,63,Night large foot energy today question camera.,2025-05-14 04:51:48
416,208,Green ago indeed remember take about.,2025-06-11 12:29:36
417,310,Explain work political school why choose or similar Mr rule three.,2025-12-26 04:27:34
418,297,Spring unit western bar long modern inside.,2025-06-11 08:51:22
419,198,As push practice production face his appear.,2026-02-27 00:50:23
420,348,Occur site reduce technology tonight program know four increase.,2025-06-23 10:37:43
421,492,Organization day record street ago financial boy.,2025-08-21 10:22:41
422,260,Its outside understand education lot whom eye professional.,2025-10-14 17:59:45
423,110,Section memory technology specific idea police parent.,2025-10-06 01:47:56
424,464,Material cover card son shake better coach Mrs group law.,2025-09-06 17:41:33
425,88,Answer director back business police choose network particular avoid.,2025-04-09 23:41:10
426,385,Process window system yourself management indicate once offer together home.,2025-06-30 01:19:31
427,13,Particular agency continue left per behind activity range.,2026-03-10 18:40:10
428,391,Hotel occur myself goal analysis indicate recent offer process keep.,2025-05-25 05:28:29
429,426,Establish public which civil present per long no herself.,2025-10-05 06:07:47
430,70,Radio mother partner bar note look pick ball certainly from agree.,2025-11-22 01:01:59
431,89,Picture represent tend officer so think throw role task fish have everyone page.,2026-02-26 05:55:19
432,0,Scientist not easy eight ability night growth.,2025-11-26 02:15:33
433,461,Fact none stuff according station order animal.,2026-03-06 01:56:00
434,437,Structure peace take take design rate usually box could it age.,2025-08-16 11:20:05
435,288,Accept consider Congress structure across already water seven.,2025-08-03 13:21:55
436,344,Story team series clearly across administration ok.,2025-04-19 16:58:52
437,130,Choice instead billion heart more traditional race lawyer article whatever up.,2025-12-29 01:39:45
438,368,Fill without wide thousand strong effect teacher.,2025-04-28 13:31:55
439,184,Election across have beat any eight doctor painting.,2026-01-26 20:39:58
440,340,Let listen occur get item describe wide high beautiful send every social must.,2026-02-22 03:42:22
441,164,Hot improve deep defense floor little store indicate.,2025-11-27 08:08:37
442,260,Shake almost evidence service interview door table me firm shake reduce.,2026-01-21 06:32:50
443,298,Receive probably positive American education next discover ten.,2025-09-07 15:53:02
444,472,Up public remember leg analysis play five executive.,2025-04-04 01:22:16
445,364,Take tell box gun them help none possible opportunity care page half example.,2025-06-21 08:01:30
446,76,Grow prevent report break thought discover audience.,2025-03-31 18:21:19
447,483,Most analysis up ball clear before seat ever thousand respond public.,2025-10-23 12:54:17
448,207,Single evidence piece oil white free about.,2025-12-12 06:29:03
449,492,Morning difficult let likely key resource interview wind add.,2025-07-15 10:20:31
450,119,Less base watch structure skill however system operation beyond enter PM lead share.,2026-02-14 14:22:39
451,447,Support per city discover age both.,2025-06-21 17:18:27
452,20,Physical study amount last but economy evening society government yeah help may.,2025-10-01 05:54:24
453,98,Project central method attorney so large eye window method carry lead table.,2025-11-11 12:22:43
454,352,Into off success forget development they because fill ask test store.,2025-07-16 05:53:41
455,90,Rock father region Mr suffer see per value culture.,2026-02-05 17:38:12
456,238,Respond affect statement chance too card itself.,2025-11-22 01:41:12
457,389,Eye air though sometimes meeting indeed everyone above Congress structure last.,2025-04-10 10:18:27
458,174,Animal write time turn evening couple authority suddenly finish.,2025-11-05 17:21:16
459,407,Idea enough system beat hit feel experience certain never nothing those others.,2026-03-21 05:30:02
460,56,Baby recognize forget cut middle goal task sea box.,2026-02-17 23:24:37
461,86,President hour realize fill field mission.,2025-04-03 17:13:46
462,276,Process air involve pressure picture free improve visit machine.,2025-06-30 07:29:08
463,410,Tree fill end any low car.,2025-05-25 03:30:03
464,499,Player anything western marriage direction worker I at fire.,2026-02-13 10:32:12
465,346,Small institution win ahead recent probably factor though again.,2025-04-28 18:04:10
466,419,Lay day data hear standard civil staff something relationship ready practice way father.,2025-04-30 07:15:17
467,229,Ago leave person rate account benefit yet lead.,2025-11-20 03:41:59
468,60,Voice effect hour can list chair.,2025-10-15 12:38:28
469,188,Within even strong see brother power.,2025-08-21 08:05:29
470,9,Piece require accept you their throw tend.,2025-05-03 00:41:27
471,386,Sound cover specific certainly practice how power sure back.,2025-09-13 15:20:03
472,385,Than color pick list put ok dream religious.,2025-06-03 13:15:43
473,109,Food community reality dark another minute indicate theory allow rather include travel write.,2025-12-30 02:50:28
474,420,Week hair edge year another single bad country.,2025-09-11 22:30:43
475,138,Other air south identify yeah concern life.,2026-03-21 02:52:44
476,53,Magazine first world without network chair police member remember politics half television win.,2025-09-29 17:35:14
477,88,Possible station your right bed finally green order economy message.,2025-12-15 22:22:41
478,87,Themselves plan sit sit animal life benefit.,2026-01-31 15:33:58
479,188,Trouble design scientist respond north appear direction.,2025-10-29 01:42:16
480,260,Star quickly wear huge commercial pressure night wrong.,2025-12-08 03:58:25
481,433,Authority mother soon seek role never.,2025-08-04 16:06:52
482,424,Theory smile best both talk article wait base finally.,2025-06-13 22:41:34
483,89,History particular act close economic and stay cup full president pretty require art.,2025-09-28 04:19:04
484,451,Draw college strategy issue third five.,2025-12-06 01:05:47
485,16,Project opportunity find participant suffer center fear.,2025-11-28 03:51:20
486,256,Cost career rise watch describe conference result decide investment performance always police life lay.,2026-01-24 23:24:20
487,31,Cost particularly tough claim option quite song.,2025-10-05 14:29:09
488,452,Trouble beautiful once rest my cause Congress lay kitchen particular their fish bank be.,2025-08-31 21:56:47
489,47,Wide form even phone available interest house standard.,2025-09-10 23:27:10
490,197,Check but discuss economy lead also one least bill box still.,2025-11-27 15:17:35
491,48,Part effort key relationship relationship determine special nation order challenge run reason.,2025-04-20 18:57:00
492,284,Option part probably stuff alone financial black mention summer impact.,2025-11-19 20:11:17
493,162,Nation west special opportunity accept grow difference up star.,2026-01-20 02:54:50
494,454,Hold south computer business sell mission bar future gas management artist mind.,2026-02-10 04:49:47
495,347,Also environmental institution here share whole somebody spring mouth.,2025-12-01 02:06:38
496,423,Bit section able similar walk mention.,2026-01-30 13:25:36
497,406,Medical hard boy skin meet Mr.,2025-12-24 10:52:33
498,258,Difficult push first last identify smile western size fall just issue.,2025-09-24 04:25:59
499,64,List simply our crime all job bring couple sometimes general miss rich movement.,2025-07-28 00:11:20
500,280,Risk single plan line center marriage letter red remain ball paper quality them tough.,2025-05-25 03:18:04
501,188,Ahead real hand good us task gun soon focus inside describe trouble.,2025-09-17 05:04:29
502,132,Five tonight my nor positive range perform local service.,2025-05-22 07:29:52
503,28,Black agency need anything behind will dinner painting his pretty.,2025-05-01 05:49:07
504,475,Participant wrong onto analysis market politics believe.,2025-09-25 01:43:50
505,308,Staff window yard between international camera school expert.,2025-08-03 02:43:22
506,94,Different tax piece fine about candidate within.,2026-01-12 07:10:38
507,158,Dark western attack fund memory director enter everything.,2025-08-15 18:34:15
508,109,Issue difficult possible these behind quickly commercial record.,2026-03-15 10:09:58
509,283,Language audience government just fill move story design civil.,2025-11-12 14:20:49
510,42,Rise require home wear read commercial tree itself.,2025-08-30 19:52:44
511,156,Wonder city sea cut mention hold significant practice meet environment better threat front.,2025-10-27 21:59:30
512,256,Kid second decide history either price figure amount.,2025-12-23 00:38:02
513,311,Matter number to successful night later.,2025-07-29 04:14:40
514,49,Where realize pull national structure want.,2025-06-08 14:11:12
515,280,Woman nice himself economic whatever young let.,2025-12-14 20:21:39
516,343,Do right though light try success couple reason especially human.,2025-10-17 19:44:28
517,262,Lawyer drop around indeed hotel rich pick determine sense appear.,2025-04-28 02:14:53
518,167,Often room term including respond also box war fly interest.,2025-04-02 02:37:19
519,124,Technology reality even official it must project soon yeah decide themselves phone federal.,2025-03-26 15:40:31
520,175,National evidence for east suggest second game.,2025-10-04 19:17:38
521,461,Lot around project cause about different one oil special while treat.,2025-07-04 01:21:37
522,380,Consider guy mean consider travel change possible.,2025-04-21 03:57:58
523,203,Nearly address hot expert that cultural network drive begin direction middle often.,2025-10-28 15:58:20
524,257,Should manage bill word factor billion civil.,2026-02-15 10:35:12
525,62,Myself maybe form everybody popular professional air.,2025-08-08 15:50:37
526,13,Unit method country speech kitchen see young court conference participant threat.,2025-07-31 03:45:43
527,99,Particular fall chair lay coach four material writer.,2026-03-10 15:14:01
528,426,The he sort read movie American their heavy foreign fall government material.,2025-04-01 05:42:45
529,155,News sure student tonight successful point sure enjoy.,2026-02-06 01:22:49
530,217,Every close father main service indeed.,2025-04-01 14:09:56
531,452,Letter after pass many parent president nor fear true.,2025-07-30 04:04:23
532,336,Quickly movement name medical account conference decision fast able consider include most.,2025-06-01 22:38:48
533,376,Heavy college fact yet region game main can pay commercial.,2025-07-24 23:37:05
534,433,Face I worker however attention girl recent community sometimes.,2026-01-18 12:58:13
535,449,Better hope church from Mrs life.,2025-04-29 05:40:16
536,371,Around actually letter too cut ever goal draw believe hold notice line score.,2025-09-14 18:31:40
537,491,Service social they pattern oil least test people identify while blue board operation.,2025-11-11 19:39:43
538,319,Once no manager feel bar approach reduce forward well these.,2025-11-19 05:02:54
539,280,Industry add exist watch history stay employee.,2025-06-19 13:56:23
540,93,Rule play just pull imagine person receive.,2025-04-21 20:28:59
541,318,House six statement put economic imagine.,2025-10-29 20:25:53
542,42,Scientist present list arrive quickly stock ground church way.,2025-09-22 10:26:18
543,291,Thing he mother news line through agent first garden majority.,2026-01-13 09:17:03
544,148,Between age hot factor quite yet far she cover argue entire.,2026-01-19 03:22:30
545,456,Hair bag see rock structure old because when fly attorney tree three oil.,2025-08-18 06:23:28
546,492,Recently attack sound list first next test news have simply land son no.,2025-05-19 02:11:10
547,403,Dinner role eat tree soldier result way.,2026-03-10 04:12:57
548,369,Air learn before because turn building.,2025-08-19 19:40:44
549,234,Wish response recent conference look security region five stand certainly.,2025-03-31 15:51:19
550,484,Movement president rock smile woman law address.,2025-08-09 14:12:17
551,106,North never my career production into travel compare staff color hope stay.,2025-06-04 22:01:31
552,499,Meeting business white same approach would study.,2025-09-19 10:06:34
553,489,Baby tonight two provide human source light new new ability field include.,2025-06-10 10:33:51
554,193,Rise build doctor cost shoulder job.,2025-09-20 15:46:01
555,439,At check easy administration follow late author guess discover direction lead material southern.,2025-04-18 14:30:19
556,400,Direction color middle sign tax experience price whole where exactly child at reflect.,2025-04-24 20:43:57
557,14,People threat ability memory hit hot low why evening specific pattern national commercial.,2026-01-31 17:55:42
558,120,Step parent scientist she move since seven set executive manager walk.,2025-10-27 22:02:41
559,123,Page impact rate individual laugh able find foreign put above.,2025-11-04 11:06:13
560,330,Hope shake American resource could experience office successful.,2025-04-18 17:46:40
561,332,Report rich thing window pull tend someone if discuss defense do another letter.,2025-08-27 20:16:38
562,89,Nature in field particular federal media.,2025-10-26 03:32:20
563,462,Develop suggest different lawyer former unit return outside law computer.,2025-10-05 04:39:59
564,283,Position maintain list catch page put establish have weight decade.,2026-02-12 02:59:24
565,83,Wear kind decide around image particular apply thousand.,2025-10-15 17:55:59
566,135,Especially or smile foot process because technology yeah any picture.,2025-04-19 21:48:37
567,186,Western high to recent live admit age sister peace until deal thank.,2025-08-02 04:51:54
568,27,Include consumer decade total strategy stage car.,2025-08-09 23:50:43
569,124,Recognize perhaps around growth early produce name reach sometimes important picture red.,2025-11-03 12:58:28
570,224,Pretty wife even animal college own very war will up newspaper nation tonight.,2025-08-30 17:18:56
571,51,Pay series structure rate right day common foot seat thus friend.,2025-05-13 09:44:07
572,471,Mrs player institution accept money shoulder ok possible town there peace.,2025-05-06 11:10:09
